{
  "candidate_files": {
    "SKILL.md": "81ab682e4fb9f0f179dc51b3adb0845bb2d2c2c514d6a33b8a58eef1ce27cee3",
    "contract.json": "267b08d6f2759a052e246262505ff9b879ce3df7b6f3d4575d1e7098a42ed47c",
    "trigger-cases.json": "ef6eb7fc2d89574083be9d50de9c72d6c3190edf7cf4e316770c46fc930aa721"
  },
  "canonical_unit_ids": [
    "competitive-strategy:unit-003",
    "competitive-strategy:unit-007",
    "competitive-strategy:unit-008",
    "competitive-strategy:unit-022",
    "competitive-strategy:unit-061",
    "competitive-strategy:unit-063",
    "competitive-strategy:unit-064",
    "competitive-strategy:unit-078",
    "competitive-strategy:unit-079",
    "competitive-strategy:unit-090",
    "competitive-strategy:unit-092"
  ],
  "capability_id": "capability:market-segmentation-and-demand-intelligence",
  "decision_references": [
    "V2-DEC-001",
    "V2-DEC-003",
    "V2-DEC-005",
    "V2-DEC-006"
  ],
  "fusion_decision_ids": [
    "V2-FUSION-0051"
  ],
  "id": "market-segmentation-and-demand-intelligence",
  "phase2_artifact_tree_sha256": "57ff1aec49b2b7b370d74d36e52659d7338adf2f16260fe62be7ada870472601",
  "retained_auxiliary_unit_ids": [],
  "root_derived_atom_ids": [],
  "schema_version": "2.0",
  "source_cluster_ids": [
    "cluster:market-segmentation-and-demand-intelligence"
  ],
  "source_defect_refs": [],
  "source_evidence": [
    "competitive-strategy/SKILL.md:14-14",
    "competitive-strategy/SKILL.md:21-24",
    "competitive-strategy/SKILL.md:26-29",
    "competitive-strategy/SKILL.md:66-66",
    "competitive-strategy/references/artifacts.md:207-220",
    "competitive-strategy/references/artifacts.md:227-230",
    "competitive-strategy/references/artifacts.md:232-235",
    "competitive-strategy/references/guest-insights.md:179-188",
    "competitive-strategy/references/guest-insights.md:205-214",
    "competitive-strategy/references/guest-insights.md:24-33",
    "competitive-strategy/references/guest-insights.md:39-48"
  ],
  "source_fragment_ids": [],
  "status": "evaluating",
  "version": "0.1.0-v2-candidate"
}
