{
  "candidate_files": {
    "SKILL.md": "f05b65a3cbdbc2dde186717fc9027f91e3832a52e72a12383eaf56bf8cc8c480",
    "contract.json": "24456576527f6ed9bfa120764f7affb9434ac5024575886550908aaf690bc237",
    "trigger-cases.json": "90f4ca984382b64c36ba5ed121fed797c46922d3c54c26f76cb65d1db6c22fdd"
  },
  "canonical_unit_ids": [
    "prioritization-frameworks:unit-002",
    "prioritization-frameworks:unit-003",
    "prioritization-frameworks:unit-004",
    "prioritization-frameworks:unit-005",
    "prioritization-frameworks:unit-006",
    "prioritization-frameworks:unit-007",
    "prioritization-frameworks:unit-008",
    "prioritization-frameworks:unit-009",
    "prioritization-frameworks:unit-010",
    "prioritization-frameworks:unit-011",
    "prioritization-frameworks:unit-012",
    "prioritization-frameworks:unit-013",
    "prioritization-frameworks:unit-014",
    "prioritization-frameworks:unit-015",
    "prioritization-frameworks:unit-016",
    "product-strategy-session:unit-023",
    "product-strategy-session:unit-024"
  ],
  "capability_id": "capability:opportunity-prioritization-and-frameworks",
  "decision_references": [
    "V2-DEC-001",
    "V2-DEC-003",
    "V2-DEC-005",
    "V2-DEC-006"
  ],
  "fusion_decision_ids": [
    "V2-FUSION-0054"
  ],
  "id": "opportunity-prioritization-and-frameworks",
  "phase2_artifact_tree_sha256": "57ff1aec49b2b7b370d74d36e52659d7338adf2f16260fe62be7ada870472601",
  "retained_auxiliary_unit_ids": [],
  "root_derived_atom_ids": [],
  "schema_version": "2.0",
  "source_cluster_ids": [
    "cluster:opportunity-prioritization-and-frameworks"
  ],
  "source_defect_refs": [],
  "source_evidence": [
    "prioritization-frameworks/SKILL.md:10-12",
    "prioritization-frameworks/SKILL.md:14-18",
    "prioritization-frameworks/SKILL.md:20-23",
    "prioritization-frameworks/SKILL.md:25-25",
    "prioritization-frameworks/SKILL.md:27-35",
    "prioritization-frameworks/SKILL.md:37-46",
    "prioritization-frameworks/SKILL.md:48-52",
    "prioritization-frameworks/SKILL.md:53-53",
    "prioritization-frameworks/SKILL.md:54-54",
    "prioritization-frameworks/SKILL.md:55-55",
    "prioritization-frameworks/SKILL.md:56-56",
    "prioritization-frameworks/SKILL.md:57-57",
    "prioritization-frameworks/SKILL.md:58-58",
    "prioritization-frameworks/SKILL.md:59-59",
    "prioritization-frameworks/SKILL.md:60-60",
    "product-strategy-session/SKILL.md:207-217",
    "product-strategy-session/SKILL.md:219-223"
  ],
  "source_fragment_ids": [],
  "status": "evaluating",
  "version": "0.1.0-v2-candidate"
}
