{
  "candidate_files": {
    "SKILL.md": "f2f2052043b9ed8f9aa1edf673dbf071c79a1933e8dd36312bf4989636035e42",
    "contract.json": "75bd464f094bb68ca71835f4c5379d9da777c9a402b799bf2c0bd2cfb32c711f",
    "trigger-cases.json": "d0a111756bd308c0dce744e59f62081509f3478b7f1bd6a2ce3cccd91c25cccb"
  },
  "canonical_unit_ids": [],
  "capability_id": "capability:documentation-authoring",
  "decision_references": [
    "V2-DEC-001",
    "V2-DEC-006"
  ],
  "fusion_decision_ids": [
    "V2-FUSION-0525",
    "V2-FUSION-0526",
    "V2-FUSION-0527",
    "V2-FUSION-0528",
    "V2-FUSION-0529",
    "V2-FUSION-0530",
    "V2-FUSION-0531",
    "V2-FUSION-0532",
    "V2-FUSION-0533",
    "V2-FUSION-0534",
    "V2-FUSION-0535",
    "V2-FUSION-0536",
    "V2-FUSION-0537",
    "V2-FUSION-0538",
    "V2-FUSION-0539",
    "V2-FUSION-0540",
    "V2-FUSION-0541",
    "V2-FUSION-0542",
    "V2-FUSION-0543",
    "V2-FUSION-0544",
    "V2-FUSION-0545"
  ],
  "id": "documentation-authoring",
  "phase2_artifact_tree_sha256": "57ff1aec49b2b7b370d74d36e52659d7338adf2f16260fe62be7ada870472601",
  "retained_auxiliary_unit_ids": [],
  "root_derived_atom_ids": [
    "v2-root:gstack/document-generate:001:root-responsibility",
    "v2-root:gstack/document-generate:007:document-generate-diataxis-documentation-writer",
    "v2-root:gstack/document-generate:008:step-0-scope-intent",
    "v2-root:gstack/document-generate:009:step-1-codebase-archaeology-research-phase",
    "v2-root:gstack/document-generate:010:step-2-diataxis-partitioning",
    "v2-root:gstack/document-generate:011:step-3-write-reference-documentation-first",
    "v2-root:gstack/document-generate:012:step-4-write-explanation-documentation",
    "v2-root:gstack/document-generate:013:concept-design-decision",
    "v2-root:gstack/document-generate:014:step-5-write-how-to-guides",
    "v2-root:gstack/document-generate:015:how-to-accomplish-specific-task",
    "v2-root:gstack/document-generate:016:steps",
    "v2-root:gstack/document-generate:017:troubleshooting",
    "v2-root:gstack/document-generate:018:step-6-write-tutorials",
    "v2-root:gstack/document-generate:019:tutorial-title-describes-what-you-ll-build-learn",
    "v2-root:gstack/document-generate:020:step-1-set-up-the-foundation",
    "v2-root:gstack/document-generate:021:step-2-build-the-first-working-piece",
    "v2-root:gstack/document-generate:022:step-n-final-step",
    "v2-root:gstack/document-generate:023:step-7-cross-document-linking-discoverability",
    "v2-root:gstack/document-generate:024:step-8-quality-self-review",
    "v2-root:gstack/document-generate:025:step-9-commit-output",
    "v2-root:gstack/document-generate:026:documentation-generated"
  ],
  "schema_version": "2.0",
  "source_cluster_ids": [],
  "source_defect_refs": [],
  "source_evidence": [
    "gstack/document-generate/SKILL.md:444-483",
    "gstack/document-generate/SKILL.md:467-488",
    "gstack/document-generate/SKILL.md:489-528",
    "gstack/document-generate/SKILL.md:5-9",
    "gstack/document-generate/SKILL.md:529-559",
    "gstack/document-generate/SKILL.md:560-567",
    "gstack/document-generate/SKILL.md:601-607",
    "gstack/document-generate/SKILL.md:608-647",
    "gstack/document-generate/SKILL.md:641-648",
    "gstack/document-generate/SKILL.md:649-688",
    "gstack/document-generate/SKILL.md:658-669",
    "gstack/document-generate/SKILL.md:674-686",
    "gstack/document-generate/SKILL.md:687-694",
    "gstack/document-generate/SKILL.md:695-734",
    "gstack/document-generate/SKILL.md:705-715",
    "gstack/document-generate/SKILL.md:716-722",
    "gstack/document-generate/SKILL.md:723-724",
    "gstack/document-generate/SKILL.md:742-760",
    "gstack/document-generate/SKILL.md:761-786",
    "gstack/document-generate/SKILL.md:787-801",
    "gstack/document-generate/SKILL.md:830-855"
  ],
  "source_fragment_ids": [],
  "status": "evaluating",
  "version": "0.1.0-v2-candidate"
}
