{
  "candidate_files": {
    "SKILL.md": "7109fd80d6a90ae354ae582c7d24dbb78872e07dd4427523aa81d4b9f4d85cd0",
    "contract.json": "537646acb8a331889c8989daf30804566119a29d5d685459edec68aee71a709d",
    "trigger-cases.json": "4bc65f4307ce5f527dadbd968f5481d20fc563506a83ff2d92dcc42507a20eb7"
  },
  "canonical_unit_ids": [
    "discovery-process:unit-013",
    "discovery-process:unit-014",
    "discovery-process:unit-015",
    "discovery-process:unit-016",
    "discovery-process:unit-017",
    "discovery-process:unit-020",
    "discovery-process:unit-037",
    "discovery-process:unit-038",
    "discovery-process:unit-039",
    "discovery-process:unit-042"
  ],
  "capability_id": "capability:research-planning-and-governance",
  "decision_references": [
    "V2-DEC-001",
    "V2-DEC-003",
    "V2-DEC-004",
    "V2-DEC-005",
    "V2-DEC-006"
  ],
  "fusion_decision_ids": [
    "V2-FUSION-0066"
  ],
  "id": "research-planning-and-governance",
  "phase2_artifact_tree_sha256": "57ff1aec49b2b7b370d74d36e52659d7338adf2f16260fe62be7ada870472601",
  "retained_auxiliary_unit_ids": [],
  "root_derived_atom_ids": [],
  "schema_version": "2.0",
  "source_cluster_ids": [
    "cluster:research-planning-and-governance"
  ],
  "source_defect_refs": [],
  "source_evidence": [
    "discovery-process/SKILL.md:131-139",
    "discovery-process/SKILL.md:143-153",
    "discovery-process/SKILL.md:155-163",
    "discovery-process/SKILL.md:165-168",
    "discovery-process/SKILL.md:170-174",
    "discovery-process/SKILL.md:215-222",
    "discovery-process/SKILL.md:364-391",
    "discovery-process/SKILL.md:393-410",
    "discovery-process/SKILL.md:412-415",
    "discovery-process/SKILL.md:451-456"
  ],
  "source_fragment_ids": [],
  "status": "evaluating",
  "version": "0.1.0-v2-candidate"
}
